Test run id: tyegp_n5pw8wdry4n8m9nf4d8ea9w56y6cx_t9ad
Phase started: Quick test - 10 users (index: 0, duration: 30s) 12:21:33(+0530)

--------------------------------------
Metrics for period to: 12:21:40(+0530) (width: 6.052s)
--------------------------------------

http.codes.200: ................................................................ 16
http.codes.404: ................................................................ 44
http.downloaded_bytes: ......................................................... 24940
http.request_rate: ............................................................. 10/sec
http.requests: ................................................................. 62
http.response_time:
  min: ......................................................................... 28
  max: ......................................................................... 354
  mean: ........................................................................ 101.9
  median: ...................................................................... 32.1
  p95: ......................................................................... 327.1
  p99: ......................................................................... 347.3
http.response_time.2xx:
  min: ......................................................................... 28
  max: ......................................................................... 44
  mean: ........................................................................ 31.5
  median: ...................................................................... 30.3
  p95: ......................................................................... 36.2
  p99: ......................................................................... 36.2
http.response_time.4xx:
  min: ......................................................................... 28
  max: ......................................................................... 354
  mean: ........................................................................ 127.5
  median: ...................................................................... 32.8
  p95: ......................................................................... 327.1
  p99: ......................................................................... 347.3
http.responses: ................................................................ 60
vusers.completed: .............................................................. 60
vusers.created: ................................................................ 62
vusers.created_by_name.Access Swagger Documentation: ........................... 16
vusers.created_by_name.Test Brand OTP Endpoint: ................................ 25
vusers.created_by_name.Test OTP Endpoint Accessibility: ........................ 21
vusers.failed: ................................................................. 0
vusers.session_length:
  min: ......................................................................... 84.8
  max: ......................................................................... 419.6
  mean: ........................................................................ 166
  median: ...................................................................... 98.5
  p95: ......................................................................... 391.6
  p99: ......................................................................... 415.8


--------------------------------------
Metrics for period to: 12:21:50(+0530) (width: 9.959s)
--------------------------------------

http.codes.200: ................................................................ 32
http.codes.404: ................................................................ 67
http.downloaded_bytes: ......................................................... 45447
http.request_rate: ............................................................. 10/sec
http.requests: ................................................................. 100
http.response_time:
  min: ......................................................................... 26
  max: ......................................................................... 331
  mean: ........................................................................ 94.8
  median: ...................................................................... 32.8
  p95: ......................................................................... 214.9
  p99: ......................................................................... 242.3
http.response_time.2xx:
  min: ......................................................................... 26
  max: ......................................................................... 33
  mean: ........................................................................ 29.2
  median: ...................................................................... 29.1
  p95: ......................................................................... 32.1
  p99: ......................................................................... 32.8
http.response_time.4xx:
  min: ......................................................................... 28
  max: ......................................................................... 331
  mean: ........................................................................ 126.1
  median: ...................................................................... 202.4
  p95: ......................................................................... 214.9
  p99: ......................................................................... 242.3
http.responses: ................................................................ 99
vusers.completed: .............................................................. 99
vusers.created: ................................................................ 100
vusers.created_by_name.Access Swagger Documentation: ........................... 33
vusers.created_by_name.Test Brand OTP Endpoint: ................................ 32
vusers.created_by_name.Test OTP Endpoint Accessibility: ........................ 35
vusers.failed: ................................................................. 0
vusers.session_length:
  min: ......................................................................... 82.2
  max: ......................................................................... 389
  mean: ........................................................................ 156.6
  median: ...................................................................... 98.5
  p95: ......................................................................... 278.7
  p99: ......................................................................... 301.9


Phase completed: Quick test - 10 users (index: 0, duration: 30s) 12:22:03(+0530)

--------------------------------------
Metrics for period to: 12:22:00(+0530) (width: 9.975s)
--------------------------------------

http.codes.200: ................................................................ 39
http.codes.404: ................................................................ 62
http.downloaded_bytes: ......................................................... 51287
http.request_rate: ............................................................. 10/sec
http.requests: ................................................................. 100
http.response_time:
  min: ......................................................................... 27
  max: ......................................................................... 340
  mean: ........................................................................ 93.5
  median: ...................................................................... 32.1
  p95: ......................................................................... 228.2
  p99: ......................................................................... 333.7
http.response_time.2xx:
  min: ......................................................................... 27
  max: ......................................................................... 37
  mean: ........................................................................ 30.2
  median: ...................................................................... 30.3
  p95: ......................................................................... 32.8
  p99: ......................................................................... 32.8
http.response_time.4xx:
  min: ......................................................................... 28
  max: ......................................................................... 340
  mean: ........................................................................ 133.4
  median: ...................................................................... 198.4
  p95: ......................................................................... 327.1
  p99: ......................................................................... 333.7
http.responses: ................................................................ 101
vusers.completed: .............................................................. 101
vusers.created: ................................................................ 100
vusers.created_by_name.Access Swagger Documentation: ........................... 39
vusers.created_by_name.Test Brand OTP Endpoint: ................................ 30
vusers.created_by_name.Test OTP Endpoint Accessibility: ........................ 31
vusers.failed: ................................................................. 0
vusers.session_length:
  min: ......................................................................... 83.3
  max: ......................................................................... 409.7
  mean: ........................................................................ 155.3
  median: ...................................................................... 96.6
  p95: ......................................................................... 290.1
  p99: ......................................................................... 391.6


--------------------------------------
Metrics for period to: 12:22:10(+0530) (width: 3.824s)
--------------------------------------

http.codes.200: ................................................................ 16
http.codes.404: ................................................................ 24
http.downloaded_bytes: ......................................................... 20760
http.request_rate: ............................................................. 10/sec
http.requests: ................................................................. 38
http.response_time:
  min: ......................................................................... 28
  max: ......................................................................... 343
  mean: ........................................................................ 85.9
  median: ...................................................................... 32.1
  p95: ......................................................................... 320.6
  p99: ......................................................................... 333.7
http.response_time.2xx:
  min: ......................................................................... 28
  max: ......................................................................... 33
  mean: ........................................................................ 30
  median: ...................................................................... 30.3
  p95: ......................................................................... 32.8
  p99: ......................................................................... 32.8
http.response_time.4xx:
  min: ......................................................................... 28
  max: ......................................................................... 343
  mean: ........................................................................ 123.1
  median: ...................................................................... 47.9
  p95: ......................................................................... 320.6
  p99: ......................................................................... 333.7
http.responses: ................................................................ 40
vusers.completed: .............................................................. 40
vusers.created: ................................................................ 38
vusers.created_by_name.Access Swagger Documentation: ........................... 15
vusers.created_by_name.Test Brand OTP Endpoint: ................................ 13
vusers.created_by_name.Test OTP Endpoint Accessibility: ........................ 10
vusers.failed: ................................................................. 0
vusers.session_length:
  min: ......................................................................... 84.8
  max: ......................................................................... 400.4
  mean: ........................................................................ 148.2
  median: ...................................................................... 96.6
  p95: ......................................................................... 391.6
  p99: ......................................................................... 391.6


All VUs finished. Total time: 30 seconds

--------------------------------
Summary report @ 12:22:04(+0530)
--------------------------------

http.codes.200: ................................................................ 103
http.codes.404: ................................................................ 197
http.downloaded_bytes: ......................................................... 142434
http.request_rate: ............................................................. 10/sec
http.requests: ................................................................. 300
http.response_time:
  min: ......................................................................... 26
  max: ......................................................................... 354
  mean: ........................................................................ 94.6
  median: ...................................................................... 32.1
  p95: ......................................................................... 242.3
  p99: ......................................................................... 340.4
http.response_time.2xx:
  min: ......................................................................... 26
  max: ......................................................................... 44
  mean: ........................................................................ 30
  median: ...................................................................... 30.3
  p95: ......................................................................... 32.8
  p99: ......................................................................... 36.2
http.response_time.4xx:
  min: ......................................................................... 28
  max: ......................................................................... 354
  mean: ........................................................................ 128.3
  median: ...................................................................... 49.9
  p95: ......................................................................... 327.1
  p99: ......................................................................... 340.4
http.responses: ................................................................ 300
vusers.completed: .............................................................. 300
vusers.created: ................................................................ 300
vusers.created_by_name.Access Swagger Documentation: ........................... 103
vusers.created_by_name.Test Brand OTP Endpoint: ................................ 100
vusers.created_by_name.Test OTP Endpoint Accessibility: ........................ 97
vusers.failed: ................................................................. 0
vusers.session_length:
  min: ......................................................................... 82.2
  max: ......................................................................... 419.6
  mean: ........................................................................ 156.9
  median: ...................................................................... 98.5
  p95: ......................................................................... 301.9
  p99: ......................................................................... 399.5
